{"$schema":"https://json-schema.org/draft/2020-12/schema","$id":"https://wrs-dojo.local/schemas/wrs-group-planning-snapshot-v1.schema.json","title":"WRS Group Planning Snapshot v1","description":"Derived, dated planning state for one instructional group. This is current-state authority input, not curriculum authority.","type":"object","additionalProperties":false,"required":["schemaVersion","snapshotId","schoolYear","generatedAt","asOf","group","students","lessonContinuity","groupTroubleSpots","materialsAndFollowUps","advancement","unresolvedConflicts","stateSources","planningReady"],"properties":{"schemaVersion":{"const":"wrs-group-planning-snapshot-v1"},"snapshotId":{"type":"string","minLength":1},"schoolYear":{"const":"2026-27"},"generatedAt":{"type":"string","format":"date-time"},"asOf":{"type":"string","format":"date"},"group":{"$ref":"#/$defs/group"},"students":{"type":"array","minItems":1,"items":{"$ref":"#/$defs/student"}},"lessonContinuity":{"$ref":"#/$defs/lessonContinuity"},"groupTroubleSpots":{"type":"array","items":{"type":"string","minLength":1}},"materialsAndFollowUps":{"type":"array","items":{"type":"string","minLength":1}},"advancement":{"$ref":"#/$defs/advancement"},"unresolvedConflicts":{"type":"array","items":{"$ref":"#/$defs/conflict"}},"stateSources":{"type":"array","minItems":1,"items":{"$ref":"#/$defs/stateSource"}},"planningReady":{"type":"boolean"},"planningBlockers":{"type":"array","items":{"type":"string","minLength":1}},"chartingConformance":{"$ref":"#/$defs/chartingConformance"}},"$defs":{"group":{"type":"object","additionalProperties":false,"required":["groupId","displayName","schedule","roster"],"properties":{"groupId":{"type":"string","minLength":1},"displayName":{"type":"string","minLength":1},"schedule":{"type":"string"},"roster":{"type":"array","minItems":1,"items":{"type":"string","minLength":1},"uniqueItems":true}}},"student":{"type":"object","additionalProperties":false,"required":["studentId","name","officialPlacement","instructionalTarget","lessonFocus","latestData","troubleSpots","recommendedInstructionalResponse"],"properties":{"studentId":{"type":"string","minLength":1},"name":{"type":"string","minLength":1},"officialPlacement":{"$ref":"#/$defs/placement"},"instructionalTarget":{"$ref":"#/$defs/instructionalTarget"},"lessonFocus":{"enum":["introduction","accuracy","automaticity-fluency"]},"latestData":{"$ref":"#/$defs/latestData"},"troubleSpots":{"type":"array","items":{"type":"string","minLength":1}},"recommendedInstructionalResponse":{"type":"array","items":{"type":"string","minLength":1}},"hfwStatus":{"type":["string","null"]},"notebookStatus":{"type":["string","null"]}}},"placement":{"type":"object","additionalProperties":false,"required":["substep","status","sourceRef"],"properties":{"substep":{"type":"string","pattern":"^[0-9]+\\.[0-9]+$"},"status":{"enum":["official","teacher-confirmed-current"]},"sourceRef":{"type":"string","minLength":1}}},"instructionalTarget":{"type":"object","additionalProperties":false,"required":["substep","relationshipToPlacement","sourceRef"],"properties":{"substep":{"type":"string","pattern":"^[0-9]+\\.[0-9]+$"},"relationshipToPlacement":{"enum":["current","review-backfill","teacher-directed"]},"sourceRef":{"type":"string","minLength":1}}},"latestData":{"type":"object","additionalProperties":false,"properties":{"realWordCharting":{"type":["string","null"]},"nonsenseWordCharting":{"type":["string","null"]},"spellingDictation":{"type":["string","null"]},"fluencyAssessment":{"type":["string","null"]}}},"lessonContinuity":{"type":"object","additionalProperties":false,"required":["lastInstructionDate","lastSubstep","partsCompleted","unfinishedWork","passageHistory","selectionHistoryRef"],"properties":{"lastInstructionDate":{"type":["string","null"],"format":"date"},"lastSubstep":{"type":"string","pattern":"^[0-9]+\\.[0-9]+$"},"partsCompleted":{"type":"array","items":{"type":"integer","minimum":1,"maximum":10},"uniqueItems":true},"unfinishedWork":{"type":"array","items":{"type":"string","minLength":1}},"passageHistory":{"type":"array","items":{"$ref":"#/$defs/passageHistoryItem"}},"selectionHistoryRef":{"type":["string","null"]}}},"passageHistoryItem":{"type":"object","additionalProperties":false,"required":["substep","passageId","status","sourceRef"],"properties":{"substep":{"type":"string","pattern":"^[0-9]+\\.[0-9]+$"},"passageId":{"type":"string","minLength":1},"title":{"type":"string"},"status":{"enum":["completed","started","planned","unknown"]},"date":{"type":["string","null"],"format":"date"},"sourceRef":{"type":"string","minLength":1}}},"advancement":{"type":"object","additionalProperties":false,"required":["status","currentSubstep","nextSubstep","condition","authorityRef"],"properties":{"status":{"enum":["continue","ready-pending-completion","teacher-confirmed-advance","unresolved"]},"currentSubstep":{"type":"string","pattern":"^[0-9]+\\.[0-9]+$"},"nextSubstep":{"type":["string","null"],"pattern":"^[0-9]+\\.[0-9]+$"},"condition":{"type":["string","null"]},"authorityRef":{"type":"string","minLength":1}}},"conflict":{"type":"object","additionalProperties":false,"required":["conflictId","severity","description","sources","blocksPlanning"],"properties":{"conflictId":{"type":"string","minLength":1},"severity":{"enum":["blocking","nonblocking"]},"description":{"type":"string","minLength":1},"sources":{"type":"array","minItems":2,"items":{"type":"string","minLength":1}},"blocksPlanning":{"type":"boolean"}}},"stateSource":{"type":"object","additionalProperties":false,"required":["sourceRef","kind","date","authorityRank","locator"],"properties":{"sourceRef":{"type":"string","minLength":1},"kind":{"enum":["explicit-teacher-report","current-snapshot","dated-lesson-data","dojo-completion-event","previous-plan"]},"date":{"type":"string","format":"date"},"authorityRank":{"type":"integer","minimum":1,"maximum":5},"locator":{"type":"string","minLength":1},"notes":{"type":"string"}}},"chartingConformance":{"type":"object","additionalProperties":false,"required":["schemaVersion","requiredItems","conforming","completedSubsteps","checks","findings","blockers"],"properties":{"schemaVersion":{"const":"wrs-charting-conformance-v1"},"requiredItems":{"const":15},"conforming":{"type":"boolean"},"completedSubsteps":{"type":"object","additionalProperties":{"type":"object","additionalProperties":false,"required":["status","substep","reason","sources"],"properties":{"status":{"enum":["resolved","none-established","conflicted"]},"substep":{"type":["string","null"]},"reason":{"type":["string","null"]},"sources":{"type":"array","items":{"type":"object","additionalProperties":false,"required":["substep","date","sourceRef","basis"],"properties":{"substep":{"type":"string"},"date":{"type":"string","format":"date"},"sourceRef":{"type":"string"},"basis":{"enum":["explicit-completion","teacher-advancement","explicit-incomplete"]}}}}}}},"checks":{"type":"array","items":{"type":"object","additionalProperties":false,"required":["student","substep","sourceRef","date","chartingType","scoredCount","correctCount","status","codes"],"properties":{"student":{"type":"string"},"substep":{"type":"string"},"sourceRef":{"type":"string"},"date":{"type":"string","format":"date"},"chartingType":{"enum":["real","nonsense",null]},"scoredCount":{"type":["integer","null"],"minimum":0},"correctCount":{"type":["integer","null"],"minimum":0},"status":{"enum":["conforming","blocked"]},"codes":{"type":"array","items":{"enum":["invalid-context","evidence-unavailable","unparseable","missing-type","short","wrong-substep","absent","completion-conflict"]}}}}},"findings":{"type":"array","items":{"type":"object","additionalProperties":false,"required":["code","student","sourceRef","message"],"properties":{"code":{"enum":["invalid-context","evidence-unavailable","unparseable","missing-type","short","wrong-substep","absent","completion-conflict"]},"student":{"type":["string","null"]},"sourceRef":{"type":["string","null"]},"message":{"type":"string"}}}},"blockers":{"type":"array","items":{"type":"string"}}}}}}
