{"schemaVersion":"wrs-group-planning-snapshot-v1","snapshotId":"5B-2026-09-17-v1","schoolYear":"2026-27","generatedAt":"2026-09-17T11:45:00-05:00","asOf":"2026-09-17","group":{"groupId":"5B","displayName":"5B","schedule":"7:45–8:30","roster":["Oliver","Ethan"]},"students":[{"studentId":"OL","name":"Oliver","officialPlacement":{"substep":"5.4","status":"teacher-confirmed-current","sourceRef":"student-snapshot-oliver-2026-09-16"},"instructionalTarget":{"substep":"5.4","relationshipToPlacement":"current","sourceRef":"daily-2026-09-17-row-262"},"lessonFocus":"accuracy","latestData":{"realWordCharting":"15/15 on 2026-09-16","nonsenseWordCharting":null,"spellingDictation":"5.4 Part 8 nearly complete as of 2026-09-17; sentence dictation remains","fluencyAssessment":null},"troubleSpots":["Accented-syllable identification during spelling needs more practice."],"recommendedInstructionalResponse":["Finish 5.4 sentence dictation, then advance to 5.5 per teacher judgment."],"hfwStatus":null,"notebookStatus":null},{"studentId":"ET","name":"Ethan","officialPlacement":{"substep":"5.4","status":"teacher-confirmed-current","sourceRef":"student-snapshot-ethan-2026-09-16"},"instructionalTarget":{"substep":"5.4","relationshipToPlacement":"current","sourceRef":"daily-2026-09-17-row-262"},"lessonFocus":"accuracy","latestData":{"realWordCharting":"13/15 on 2026-09-16; exact oral responses on two errors remain unverified","nonsenseWordCharting":null,"spellingDictation":"5.4 Part 8 nearly complete as of 2026-09-17; sentence dictation remains","fluencyAssessment":null},"troubleSpots":["Accented-syllable identification during spelling needs more practice."],"recommendedInstructionalResponse":["Finish 5.4 sentence dictation, then advance to 5.5 per teacher judgment.","Do not treat the unverified oral-error wording as a confirmed error pattern."],"hfwStatus":null,"notebookStatus":null}],"lessonContinuity":{"lastInstructionDate":"2026-09-17","lastSubstep":"5.4","partsCompleted":[6,7],"unfinishedWork":["Part 8 sentence dictation remains before 5.4 is complete."],"passageHistory":[],"selectionHistoryRef":null},"groupTroubleSpots":["Accented-syllable identification in spelling remains difficult but is improving."],"materialsAndFollowUps":[],"advancement":{"status":"ready-pending-completion","currentSubstep":"5.4","nextSubstep":"5.5","condition":"Finish the remaining 5.4 Part 8 sentence dictation.","authorityRef":"daily-2026-09-17-row-262"},"unresolvedConflicts":[],"stateSources":[{"sourceRef":"daily-2026-09-17-row-262","kind":"explicit-teacher-report","date":"2026-09-17","authorityRank":1,"locator":"WRS 2026–27 Daily Notes Log > Daily Log > row 262","notes":"Teacher explicitly directed finish sentence dictation, then advance to 5.5."},{"sourceRef":"student-snapshot-5b-2026-09-16","kind":"current-snapshot","date":"2026-09-16","authorityRank":2,"locator":"WRS 2026–27 Student Data Log > Current Snapshot > Oliver/Ethan rows","notes":"Provides latest charting and documented spelling trouble spots."}],"planningReady":true,"planningBlockers":[]}